{"$schema":"web-asset-manifest.v1.schema.json","entrypoint":{"document":"index.html","graph":[{"assets":[],"css":[],"dynamicImports":[],"file":"assets/chunk-AgentFailureHistoryPanel-e97b6a48.js","imports":["_chunk-utcTimestamp-b0ee1028.js","index.html"],"isDynamicEntry":false,"isEntry":false,"key":"_chunk-AgentFailureHistoryPanel-e97b6a48.js"},{"assets":[],"css":[],"dynamicImports":[],"file":"assets/chunk-ObservationChart-62ca99f1.js","imports":["_chunk-useResponsiveChart-de424d35.js","index.html"],"isDynamicEntry":false,"isEntry":false,"key":"_chunk-ObservationChart-62ca99f1.js"},{"assets":[],"css":[],"dynamicImports":[],"file":"assets/chunk-activityApi-c80a5712.js","imports":["_chunk-utcTimestamp-b0ee1028.js","index.html"],"isDynamicEntry":false,"isEntry":false,"key":"_chunk-activityApi-c80a5712.js"},{"assets":[],"css":[],"dynamicImports":[],"file":"assets/chunk-alertAdminListsApi-f957b7a6.js","imports":["_chunk-alertRuntimeParser-a4c13282.js","_chunk-utcTimestamp-b0ee1028.js"],"isDynamicEntry":false,"isEntry":false,"key":"_chunk-alertAdminListsApi-f957b7a6.js"},{"assets":[],"css":[],"dynamicImports":[],"file":"assets/chunk-alertRuleAdminActions-e53f079c.js","imports":["_chunk-alertRuleSignals-200dc172.js","_chunk-alertRuntimeParser-a4c13282.js","_chunk-utcTimestamp-b0ee1028.js"],"isDynamicEntry":false,"isEntry":false,"key":"_chunk-alertRuleAdminActions-e53f079c.js"},{"assets":[],"css":[],"dynamicImports":[],"file":"assets/chunk-alertRuleAdminApi-726a6ed1.js","imports":["_chunk-alertRuleSignals-200dc172.js","_chunk-alertRuntimeParser-a4c13282.js","_chunk-utcTimestamp-b0ee1028.js"],"isDynamicEntry":false,"isEntry":false,"key":"_chunk-alertRuleAdminApi-726a6ed1.js"},{"assets":[],"css":[],"dynamicImports":[],"file":"assets/chunk-alertRuleSignals-200dc172.js","imports":[],"isDynamicEntry":false,"isEntry":false,"key":"_chunk-alertRuleSignals-200dc172.js"},{"assets":[],"css":[],"dynamicImports":[],"file":"assets/chunk-alertRuntimeParser-a4c13282.js","imports":["_chunk-utcTimestamp-b0ee1028.js"],"isDynamicEntry":false,"isEntry":false,"key":"_chunk-alertRuntimeParser-a4c13282.js"},{"assets":[],"css":[],"dynamicImports":[],"file":"assets/chunk-analyticsApi-ea4fdf44.js","imports":["_chunk-sqlBaselineModel-e3255b5c.js","_chunk-utcTimestamp-b0ee1028.js"],"isDynamicEntry":false,"isEntry":false,"key":"_chunk-analyticsApi-ea4fdf44.js"},{"assets":[],"css":[],"dynamicImports":[],"file":"assets/chunk-analyticsSurfaceCatalog-c7bed43a.js","imports":[],"isDynamicEntry":false,"isEntry":false,"key":"_chunk-analyticsSurfaceCatalog-c7bed43a.js"},{"assets":[],"css":[],"dynamicImports":[],"file":"assets/chunk-availabilityEvidence-8db2fde6.js","imports":[],"isDynamicEntry":false,"isEntry":false,"key":"_chunk-availabilityEvidence-8db2fde6.js"},{"assets":[],"css":[],"dynamicImports":[],"file":"assets/chunk-deadlockApi-55f1d6a8.js","imports":["_chunk-utcTimestamp-b0ee1028.js","index.html"],"isDynamicEntry":false,"isEntry":false,"key":"_chunk-deadlockApi-55f1d6a8.js"},{"assets":[],"css":[],"dynamicImports":[],"file":"assets/chunk-fleetGridModel-124fdc97.js","imports":["_chunk-useOverviewAnalytics-732d4eb4.js"],"isDynamicEntry":false,"isEntry":false,"key":"_chunk-fleetGridModel-124fdc97.js"},{"assets":[],"css":[],"dynamicImports":[],"file":"assets/chunk-overviewModel-a971f758.js","imports":["_chunk-utcTimestamp-b0ee1028.js"],"isDynamicEntry":false,"isEntry":false,"key":"_chunk-overviewModel-a971f758.js"},{"assets":[],"css":[],"dynamicImports":[],"file":"assets/chunk-sqlBaselineModel-e3255b5c.js","imports":[],"isDynamicEntry":false,"isEntry":false,"key":"_chunk-sqlBaselineModel-e3255b5c.js"},{"assets":[],"css":[],"dynamicImports":[],"file":"assets/chunk-useAlertAdminList-53568923.js","imports":["index.html"],"isDynamicEntry":false,"isEntry":false,"key":"_chunk-useAlertAdminList-53568923.js"},{"assets":[],"css":["assets/useAlertMutationLane-52057dbc.css"],"dynamicImports":[],"file":"assets/chunk-useAlertMutationLane-38c568ef.js","imports":["_chunk-alertRuntimeParser-a4c13282.js","_chunk-utcTimestamp-b0ee1028.js","index.html"],"isDynamicEntry":false,"isEntry":false,"key":"_chunk-useAlertMutationLane-38c568ef.js"},{"assets":[],"css":["assets/useChartInspection-92e5b168.css"],"dynamicImports":[],"file":"assets/chunk-useChartInspection-1c224539.js","imports":["index.html"],"isDynamicEntry":false,"isEntry":false,"key":"_chunk-useChartInspection-1c224539.js"},{"assets":[],"css":["assets/useChartReferences-886831d1.css"],"dynamicImports":[],"file":"assets/chunk-useChartReferences-5f4d8f52.js","imports":["_chunk-alertRuleAdminApi-726a6ed1.js","_chunk-analyticsApi-ea4fdf44.js","_chunk-sqlBaselineModel-e3255b5c.js","_chunk-useOverviewAnalytics-732d4eb4.js","index.html"],"isDynamicEntry":false,"isEntry":false,"key":"_chunk-useChartReferences-5f4d8f52.js"},{"assets":[],"css":["assets/useOverviewAnalytics-59aa23b1.css"],"dynamicImports":[],"file":"assets/chunk-useOverviewAnalytics-732d4eb4.js","imports":["_chunk-availabilityEvidence-8db2fde6.js","_chunk-sqlBaselineModel-e3255b5c.js","_chunk-useResponsiveChart-de424d35.js","_chunk-utcTimestamp-b0ee1028.js","index.html"],"isDynamicEntry":false,"isEntry":false,"key":"_chunk-useOverviewAnalytics-732d4eb4.js"},{"assets":[],"css":["assets/useResponsiveChart-ec3890a5.css"],"dynamicImports":[],"file":"assets/chunk-useResponsiveChart-de424d35.js","imports":["_chunk-overviewModel-a971f758.js","_chunk-utcTimestamp-b0ee1028.js","index.html"],"isDynamicEntry":false,"isEntry":false,"key":"_chunk-useResponsiveChart-de424d35.js"},{"assets":[],"css":[],"dynamicImports":[],"file":"assets/chunk-utcTimestamp-b0ee1028.js","imports":[],"isDynamicEntry":false,"isEntry":false,"key":"_chunk-utcTimestamp-b0ee1028.js"},{"assets":[],"css":[],"dynamicImports":[],"file":"assets/chunk-waitTrendChartModel-65452521.js","imports":["_chunk-utcTimestamp-b0ee1028.js","index.html"],"isDynamicEntry":false,"isEntry":false,"key":"_chunk-waitTrendChartModel-65452521.js"},{"assets":[],"css":[],"dynamicImports":[],"file":"assets/diagnosticWorkflow-44937fea.css","imports":[],"isDynamicEntry":false,"isEntry":false,"key":"_diagnosticWorkflow-44937fea.css"},{"assets":[],"css":[],"dynamicImports":[],"file":"assets/useAlertMutationLane-52057dbc.css","imports":[],"isDynamicEntry":false,"isEntry":false,"key":"_useAlertMutationLane-52057dbc.css"},{"assets":[],"css":[],"dynamicImports":[],"file":"assets/useChartInspection-92e5b168.css","imports":[],"isDynamicEntry":false,"isEntry":false,"key":"_useChartInspection-92e5b168.css"},{"assets":[],"css":[],"dynamicImports":[],"file":"assets/useChartReferences-886831d1.css","imports":[],"isDynamicEntry":false,"isEntry":false,"key":"_useChartReferences-886831d1.css"},{"assets":[],"css":[],"dynamicImports":[],"file":"assets/useOverviewAnalytics-59aa23b1.css","imports":[],"isDynamicEntry":false,"isEntry":false,"key":"_useOverviewAnalytics-59aa23b1.css"},{"assets":[],"css":[],"dynamicImports":[],"file":"assets/useResponsiveChart-ec3890a5.css","imports":[],"isDynamicEntry":false,"isEntry":false,"key":"_useResponsiveChart-ec3890a5.css"},{"assets":[],"css":["assets/index-2e26f06d.css"],"dynamicImports":["src/features/activity/TargetActivityPanel.tsx","src/features/activity/TargetWaitsPanel.tsx","src/features/alerts/FleetAlertsPage.tsx","src/features/alerts/RuleTemplatesPage.tsx","src/features/alerts/TargetAlertRulesPanel.tsx","src/features/alerts/TargetAlertsPanel.tsx","src/features/alerts/TargetDestinationsPanel.tsx","src/features/alerts/TargetMaintenancePanel.tsx","src/features/analytics/AnalyticsPage.tsx","src/features/deadlocks/TargetDeadlockPanel.tsx","src/features/health/TargetHealthPanel.tsx","src/features/operations/OperationsPanel.tsx","src/features/overview/OverviewPage.tsx","src/features/queries/TargetQueryPerformancePanel.tsx","src/features/reports/ReportsPanel.tsx","src/features/resources/TargetResourcesPanel.tsx","src/features/targets/ServersPage.tsx","src/features/targets/TargetManagementPanel.tsx","src/features/targets/TargetPermissionScriptPanel.tsx"],"file":"assets/entry-index-1bb5358a.js","imports":["_chunk-alertRuntimeParser-a4c13282.js","_chunk-analyticsSurfaceCatalog-c7bed43a.js","_chunk-overviewModel-a971f758.js","_chunk-utcTimestamp-b0ee1028.js"],"isDynamicEntry":false,"isEntry":true,"key":"index.html"},{"assets":[],"css":["assets/TargetActivityPanel-d3f06cce.css"],"dynamicImports":[],"file":"assets/chunk-TargetActivityPanel-19cf6652.js","imports":["_chunk-activityApi-c80a5712.js","_chunk-overviewModel-a971f758.js","_chunk-utcTimestamp-b0ee1028.js","index.html"],"isDynamicEntry":true,"isEntry":false,"key":"src/features/activity/TargetActivityPanel.tsx"},{"assets":[],"css":["assets/TargetWaitsPanel-417f9792.css"],"dynamicImports":[],"file":"assets/chunk-TargetWaitsPanel-eb151f49.js","imports":["_chunk-ObservationChart-62ca99f1.js","_chunk-activityApi-c80a5712.js","_chunk-useChartInspection-1c224539.js","_chunk-utcTimestamp-b0ee1028.js","_chunk-waitTrendChartModel-65452521.js","index.html","src/features/activity/TargetActivityPanel.tsx"],"isDynamicEntry":true,"isEntry":false,"key":"src/features/activity/TargetWaitsPanel.tsx"},{"assets":[],"css":["assets/diagnosticWorkflow-44937fea.css"],"dynamicImports":[],"file":"assets/chunk-FleetAlertsPage-d8271e1a.js","imports":["_chunk-alertRuleSignals-200dc172.js","_chunk-overviewModel-a971f758.js","_chunk-useAlertMutationLane-38c568ef.js","_chunk-utcTimestamp-b0ee1028.js","index.html"],"isDynamicEntry":true,"isEntry":false,"key":"src/features/alerts/FleetAlertsPage.tsx"},{"assets":[],"css":[],"dynamicImports":[],"file":"assets/chunk-RuleTemplatesPage-949e3720.js","imports":["_chunk-alertRuleAdminActions-e53f079c.js","_chunk-alertRuleSignals-200dc172.js","_chunk-alertRuntimeParser-a4c13282.js","_chunk-utcTimestamp-b0ee1028.js","index.html"],"isDynamicEntry":true,"isEntry":false,"key":"src/features/alerts/RuleTemplatesPage.tsx"},{"assets":[],"css":[],"dynamicImports":[],"file":"assets/chunk-TargetAlertRulesPanel-536e7778.js","imports":["_chunk-alertRuleAdminActi